{
  "schema_version": "3.0.0",
  "commit": "33039d975675172693f164e5a25927ac17350dc5",
  "artifact_sha256": "72acf0d8384f59245a1c3bc85388edb3d6a1aa39d125ae759105ce966b6c3775",
  "target_environment": "local-readiness-evaluation",
  "gates": {
    "G0": {
      "status": "BLOCKED",
      "evidence_ref": "fixture:synthetic",
      "reason": "synthetic example only"
    },
    "G1": {
      "status": "BLOCKED",
      "evidence_ref": "fixture:synthetic",
      "reason": "synthetic example only"
    },
    "G2": {
      "status": "BLOCKED",
      "evidence_ref": "fixture:synthetic",
      "reason": "synthetic example only"
    },
    "G3": {
      "status": "BLOCKED",
      "evidence_ref": "fixture:synthetic",
      "reason": "synthetic example only"
    },
    "G4": {
      "status": "BLOCKED",
      "evidence_ref": "fixture:synthetic",
      "reason": "synthetic example only"
    },
    "G5": {
      "status": "BLOCKED",
      "evidence_ref": "fixture:synthetic",
      "reason": "synthetic example only"
    },
    "G6": {
      "status": "BLOCKED",
      "evidence_ref": "fixture:synthetic",
      "reason": "synthetic example only"
    }
  },
  "implementation": null,
  "independent_review": null,
  "security_review": null,
  "staging": null,
  "approval": null,
  "rollback_ref": null,
  "check_provenance": []
}
